rank,title,category,description,source,date,impact,type
1,Anysphere Raises $900M for Cursor AI Coding Assistant,Development Tools,"San Francisco-based startup secures massive funding round, reaching $9.9B valuation for AI-powered coding assistant that actively participates in development workflows.",TechStartups,2025-06-09,High,Funding
2,Mistral Releases Magistral Reasoning Models,AI Models,French AI lab launches first reasoning model family with Magistral Small (24B parameters) and Medium versions for step-by-step problem solving.,TechCrunch,2025-06-10,High,Product Launch
3,OpenAI's Open Model Delayed Until Late Summer,AI Models,CEO Sam Altman announces delay of first open-source model in years due to 'unexpected and amazing' research breakthrough requiring more time.,TechCrunch,2025-06-10,Medium,Product Update
4,Atua AI Introduces Adaptive Logic Tools for Cross-Network Scaling,Blockchain AI,Decentralized AI platform unveils adaptive logic tools for seamless AI automation across multiple blockchain networks including Ethereum and BNB Chain.,Newsfile,2025-06-11,Medium,Product Launch
5,Microsoft AI Toolkit for VS Code June Update,Development Tools,"Version 0.14.0 introduces integrated evaluation for AI agents, built-in evaluators, model conversion tools, and LoRA adapter training for Phi Silica.",Microsoft,2025-06-11,Medium,Product Update
6,Aiera Secures $25M Series B for Financial AI Research,Fintech AI,"Wall Street consortium funds AI platform for earnings call analysis and market research, with partnerships from 10 major investment banks.",TechStartups,2025-06-09,Medium,Funding
7,Thread AI Lands $20M Series A for Enterprise AI Workflows,Enterprise AI,Former Palantir executives' startup raises funding for 'Lemma' composable AI infrastructure to help large organizations build custom AI modules.,TechStartups,2025-06-09,Medium,Funding
8,OpenAI Launches o3-pro for Pro Users,AI Models,"Most powerful reasoning model now available in ChatGPT and API for Pro users, offering enhanced problem-solving capabilities for complex queries.",OpenAI,2025-06-10,High,Product Launch
9,Google AI Overviews Impact on Publisher Traffic,Search AI,"AI-powered search features causing significant traffic decline for publishers, with NYT seeing desktop/mobile search traffic drop from 44% to 36.5%.",TechCrunch,2025-06-10,High,Industry Impact
10,Hugging Face Releases ColQwen2 Model Preview,Open Source,"New model added to transformers library with v4.52.4-ColQwen2-preview tag, expanding open-source AI model ecosystem.",Hugging Face,2025-06-02,Low,Product Launch
